{
  "agent_id": "vc-planner",
  "purpose": "Create bounded module plans and execution-ready work packages.",
  "inputs": [
    "project",
    "module"
  ],
  "required_artifacts": [
    ".ai/state/current-task.json",
    ".ai/workflows/executable/build-module.workflow.json"
  ],
  "expected_output_schema": ".ai/contracts/runtime-output.schema.json",
  "success_signal": "status=passed",
  "failure_signal": "status=failed",
  "allowed_follow_up_actions": [
    "continue",
    "replan"
  ],
  "escalation_behavior": "Escalate through the policy engine when failure class is non-retryable or missing input blocks execution."
}
